Account ID,Company Name,Domain Company,Tax Code,Address,Billing address,Industry,Source,Company Size,Sales Leader,Sale Owner,Product of interest,Master Contact,All Deals,Create Deal,Create Contact,Create Prospect,Date Created,Prospect,Last Modified Date,Modified By
GCP_Acc_184,"HOMES VN CO.,LTD <Masterise Homes>",masterisehomes.com,0316001930,"VP 07.01, Lầu 7, số 275 đường Võ Nguyên Giáp, Khu phố 4, Phường An Khánh, TP Hồ Chí Minh, Việt Nam",,,,,Phạm Tiến Thiêm,Đậu Thị Quỳnh Trâm,GCP,,,Create Deal,Create Contact,Create Prospect,2026/05/15 09:17,199,2026/05/15 09:21,Đậu Thị Quỳnh Trâm
GCP_Acc_185,Harmonix Finance,harmonix.fi,,,,,,,Phạm Tiến Thiêm,Đậu Thị Quỳnh Trâm,GCP,,,Create Deal,Create Contact,Create Prospect,2026/05/15 09:49,200,2026/05/15 10:00,Đậu Thị Quỳnh Trâm
GCP_Acc_186,Tập đoàn PPJ Group (PPJ Group) ,ppj-group.com.vn,0304995318,"48 Đường Tăng Nhơn Phú, Phường Tăng Nhơn Phú, TP Hồ Chí Minh, Việt Nam",,,,,Phạm Tiến Thiêm,Đậu Thị Quỳnh Trâm,GCP,,,Create Deal,Create Contact,Create Prospect,2026/05/15 10:01,201,2026/05/15 10:40,Đậu Thị Quỳnh Trâm
GCP_Acc_187,DAITANVIET JOINT STOCK COMPANY,newviet.vn,0302505776,"145 Tôn Thất Đạm, Phường Sài Gòn, TP Hồ Chí Minh, Việt Nam",,,,,Phạm Tiến Thiêm,Đậu Thị Quỳnh Trâm,GCP,,,Create Deal,Create Contact,Create Prospect,2026/05/15 10:41,202,2026/05/15 10:48,Đậu Thị Quỳnh Trâm
GCP_Acc_188,Cricket One Asia,cricketone.asia,0314429625,"383/3/51 đường Quang Trung, Phường Gò Vấp, TP Hồ Chí Minh, Việt Nam",,,,,Phạm Tiến Thiêm,Đậu Thị Quỳnh Trâm,GCP,,,Create Deal,Create Contact,Create Prospect,2026/05/15 12:28,,2026/05/15 12:28,
GCP_Acc_189,"TAY NAM STEEL MANUFACTURING & TRADING CO., LTD",tontaynam.com.vn,1101815829,"CCN Thiên Lộc Thành, Ấp 4, Xã Mỹ Lệ, Tỉnh Tây Ninh, Việt Nam",,,,,Phạm Tiến Thiêm,Đậu Thị Quỳnh Trâm,GCP,,,Create Deal,Create Contact,Create Prospect,2026/05/15 12:29,,2026/05/15 12:29,
GCP_Acc_190,MFast,mfast.vn,0314647863,"Tầng 2, tòa nhà Athena, 146-148 Cộng Hòa, Phường Bảy Hiền, TP Hồ Chí Minh, Việt Nam",,,,,Phạm Tiến Thiêm,Đậu Thị Quỳnh Trâm,GCP,,,Create Deal,Create Contact,Create Prospect,2026/05/15 12:30,,2026/05/15 12:30,
GCP_Acc_191,JAMJA,jamja.vn,0107424266,"Tầng 5, số 71 Nguyễn Chí Thanh, Phường Giảng Võ, TP Hà Nội, Việt Nam",,,,,Phạm Tiến Thiêm,Đậu Thị Quỳnh Trâm,GCP,,,Create Deal,Create Contact,Create Prospect,2026/05/15 17:25,,2026/05/15 17:25,
GCP_Acc_220,TRV Holdings Unicorn 2035 in edutech & Fintech for Smart Construction Industry,,000000,,,,,,Phạm Tiến Thiêm,Đậu Thị Quỳnh Trâm,GCP,,,Create Deal,Create Contact,Create Prospect,2026/05/22 16:42,213,2026/05/22 16:45,Đậu Thị Quỳnh Trâm
GCP_Acc_221,Equest education group ,equest.vn,0301700090,"Lầu 3, Tòa Nhà Quỳnh Lan, 60 Hai Bà Trưng, Phường Sài Gòn, TP Hồ Chí Minh, Việt Nam",,,,,Phạm Tiến Thiêm,Đậu Thị Quỳnh Trâm,GCP,,,Create Deal,Create Contact,Create Prospect,2026/05/22 16:47,214,2026/05/22 16:51,Đậu Thị Quỳnh Trâm
GCP_Acc_222,TH School,thschool.edu.vn,,,,,,,Phạm Tiến Thiêm,Đậu Thị Quỳnh Trâm,GCP,,,Create Deal,Create Contact,Create Prospect,2026/05/22 16:53,215,2026/05/22 16:56,Đậu Thị Quỳnh Trâm
GCP_Acc_223,ILA ,ila.edu.vn,,,,,,,Phạm Tiến Thiêm,Đậu Thị Quỳnh Trâm,GCP,,,Create Deal,Create Contact,Create Prospect,2026/05/22 16:58,216,2026/05/22 17:04,Đậu Thị Quỳnh Trâm
GCP_Acc_224,Yola,yola.vn,0309139430,,,,,,Phạm Tiến Thiêm,Đậu Thị Quỳnh Trâm,GCP,,,Create Deal,Create Contact,Create Prospect,2026/05/22 17:05,217,2026/05/22 17:08,Đậu Thị Quỳnh Trâm
GCP_Acc_226,VUS - The English Center,teachenglish.vus.edu.vn,,,,,,,Phạm Tiến Thiêm,Đậu Thị Quỳnh Trâm,GCP,,,Create Deal,Create Contact,Create Prospect,2026/05/22 17:10,218,2026/05/25 09:31,Đậu Thị Quỳnh Trâm
GCP_Acc_227,Appollo,apollo.edu.vn,,,,,,,Phạm Tiến Thiêm,Đậu Thị Quỳnh Trâm,GCP,,,Create Deal,Create Contact,Create Prospect,2026/05/22 17:11,219,2026/05/25 09:39,Đậu Thị Quỳnh Trâm
GCP_Acc_229,"PK Electric Co. Ltd,  CÔNG TY TNHH ĐIỆN PK",pkled.vn,,,,,,,Phạm Tiến Thiêm,Đậu Thị Quỳnh Trâm,GCP,,,Create Deal,Create Contact,Create Prospect,2026/05/25 09:41,220,2026/05/25 09:43,Đậu Thị Quỳnh Trâm
GCP_Acc_167,,,,,,,,,,,,,,Create Deal,Create Contact,Create Prospect,2026/05/11 17:27,,2026/05/11 17:46,Lê Đức Thành
GCP_Acc_168,,,,,,,,,,,,,,Create Deal,Create Contact,Create Prospect,2026/05/11 17:27,,2026/05/11 17:46,Lê Đức Thành
GCP_Acc_197,,,,,,,,,,,,,,Create Deal,Create Contact,Create Prospect,2026/05/20 15:51,,2026/05/20 15:51,Lê Đức Thành
GCP_Acc_198,,,,,,,,,,,,,,Create Deal,Create Contact,Create Prospect,2026/05/20 15:51,,2026/05/20 15:51,Lê Đức Thành
GCP_Acc_208,,,,,,,,,,,,,,Create Deal,Create Contact,Create Prospect,2026/05/20 16:14,,2026/05/20 16:17,Lê Đức Thành
GCP_Acc_210,,,,,,,,,,,,,,Create Deal,Create Contact,Create Prospect,2026/05/20 16:17,,2026/05/20 16:17,Lê Đức Thành
GCP_Acc_211,,,,,,,,,,,,,,Create Deal,Create Contact,Create Prospect,2026/05/20 16:17,,2026/05/20 16:17,Lê Đức Thành
GCP_Acc_212,,,,,,,,,,,,,,Create Deal,Create Contact,Create Prospect,2026/05/20 16:17,,2026/05/20 16:18,Lê Đức Thành
